{"$schema":"https://json-schema.org/draft/2020-12/schema","type":"object","required":["schema_version","step","research_status","episode_count","seed","ppo_seeds","compute_budgets_ms","formal_statistics_deferred_to_step29","formal_performance_deferred_to_step30"],"properties":{"schema_version":{"const":"robustness-engineering-config-v1"},"step":{"const":28},"research_status":{"const":"synthetic_validation_only_non_research"},"episode_count":{"type":"integer","minimum":20},"seed":{"type":"integer"},"ppo_seeds":{"type":"array","minItems":5,"items":{"type":"integer"}},"compute_budgets_ms":{"type":"array","minItems":1,"items":{"type":"number","exclusiveMinimum":0}},"formal_statistics_deferred_to_step29":{"const":true},"formal_performance_deferred_to_step30":{"const":true}},"additionalProperties":false}
